====================================================================================================
  CROSS-SYMBOL VALIDATION — 7 New Symbols (Out-of-Sample)
  Strategy: min_ev=1, disp≥10bps, off=0.15%, TP=0.12%, no SL, 60min
====================================================================================================

────────────────────────────────────────────────────────────────────────────────
  DOGEUSDT (ORIGINAL — in-sample)
────────────────────────────────────────────────────────────────────────────────
  Loading 3018 liq files... 500 1000 1500 2000 2500 3000 done (93,913)
  Loading 1763 ticker files (REST)... 500 1000 1500 done (1,261,993)
  Building bars... 105,196 bars
  P95 signals: 1313, with disp≥10: 692
  ✅ Config2 AGGR     n= 539  WR= 97.0%  avg=+0.0404%  tot= +21.76%  sh=  +5.6  dd= 5.44%  TP=  97% SL=   0% TO=   3%
  ✅ Config1 SAFE     n= 539  WR= 88.7%  avg=+0.0350%  tot= +18.87%  sh=  +7.4  dd= 2.21%  TP=  89% SL=  11% TO=   1%
    ✅ 2025-05: n=244  WR= 97.1%  tot= +9.41%
    ✅ 2025-06: n=150  WR= 96.7%  tot= +4.39%
    ✅ 2025-07: n= 42  WR= 97.6%  tot= +2.35%
    ✅ 2025-08: n= 60  WR= 95.0%  tot= +2.18%
    ✅ 2026-02: n= 43  WR=100.0%  tot= +3.44%
    Positive months: 5/5

────────────────────────────────────────────────────────────────────────────────
  SOLUSDT (ORIGINAL — in-sample)
────────────────────────────────────────────────────────────────────────────────
  Loading 3107 liq files... 500 1000 1500 2000 2500 3000 done (189,603)
  Loading 1763 ticker files (REST)... 500 1000 1500 done (1,261,981)
  Building bars... 105,195 bars
  P95 signals: 2064, with disp≥10: 892
  ✅ Config2 AGGR     n= 670  WR= 95.1%  avg=+0.0410%  tot= +27.44%  sh=  +8.8  dd= 5.75%  TP=  95% SL=   0% TO=   5%
  ✅ Config1 SAFE     n= 670  WR= 88.2%  avg=+0.0331%  tot= +22.19%  sh=  +7.0  dd= 2.54%  TP=  88% SL=  11% TO=   1%
    ✅ 2025-05: n=213  WR= 95.8%  tot=+12.11%
    ✅ 2025-06: n=274  WR= 93.4%  tot= +5.24%
    ✅ 2025-07: n= 39  WR= 94.9%  tot= +1.68%
    ✅ 2025-08: n= 74  WR= 94.6%  tot= +2.82%
    ✅ 2026-02: n= 70  WR=100.0%  tot= +5.60%
    Positive months: 5/5

────────────────────────────────────────────────────────────────────────────────
  ETHUSDT (ORIGINAL — in-sample)
────────────────────────────────────────────────────────────────────────────────
  Loading 3089 liq files... 500 1000 1500 2000 2500 3000 done (328,388)
  Loading 1763 ticker files (REST)... 500 1000 1500 done (1,261,971)
  Building bars... 105,193 bars
  P95 signals: 2782, with disp≥10: 1194
  ✅ Config2 AGGR     n= 852  WR= 95.4%  avg=+0.0343%  tot= +29.20%  sh=  +6.1  dd= 3.56%  TP=  95% SL=   0% TO=   5%
  ✅ Config1 SAFE     n= 852  WR= 87.8%  avg=+0.0293%  tot= +24.98%  sh=  +6.0  dd= 4.66%  TP=  88% SL=  11% TO=   1%
    ✅ 2025-05: n=328  WR= 97.3%  tot=+15.54%
    ✅ 2025-06: n=324  WR= 93.8%  tot= +5.65%
    ✅ 2025-07: n= 44  WR= 93.2%  tot= +2.45%
    ✅ 2025-08: n= 76  WR= 94.7%  tot= +2.58%
    ✅ 2026-02: n= 80  WR= 96.2%  tot= +2.98%
    Positive months: 5/5

────────────────────────────────────────────────────────────────────────────────
  XRPUSDT (ORIGINAL — in-sample)
────────────────────────────────────────────────────────────────────────────────
  Loading 2962 liq files... 500 1000 1500 2000 2500 done (128,466)
  Loading 1763 ticker files (REST)... 500 1000 1500 done (1,261,981)
  Building bars... 105,196 bars
  P95 signals: 1597, with disp≥10: 630
  ✅ Config2 AGGR     n= 477  WR= 95.6%  avg=+0.0459%  tot= +21.91%  sh= +10.8  dd= 2.53%  TP=  95% SL=   0% TO=   5%
  ✅ Config1 SAFE     n= 477  WR= 87.8%  avg=+0.0314%  tot= +15.00%  sh=  +6.6  dd= 5.15%  TP=  88% SL=  11% TO=   1%
    ✅ 2025-05: n=170  WR= 93.5%  tot= +5.71%
    ✅ 2025-06: n=130  WR= 94.6%  tot= +5.96%
    ✅ 2025-07: n= 47  WR= 97.9%  tot= +2.16%
    ✅ 2025-08: n= 79  WR= 98.7%  tot= +5.34%
    ✅ 2026-02: n= 51  WR= 98.0%  tot= +2.73%
    Positive months: 5/5

────────────────────────────────────────────────────────────────────────────────
  ADAUSDT (NEW — out-of-sample)
────────────────────────────────────────────────────────────────────────────────
  Loading 1462 liq files... 500 1000 done (20,942)
  Loading ticker CSV... done (2,304,102)
  Building bars... 102,940 bars
  P95 signals: 629, with disp≥10: 295
  ✅ Config2 AGGR     n= 243  WR= 97.9%  avg=+0.0671%  tot= +16.30%  sh= +30.8  dd= 0.96%  TP=  98% SL=   0% TO=   2%
  ✅ Config1 SAFE     n= 243  WR= 93.0%  avg=+0.0621%  tot= +15.09%  sh= +16.0  dd= 1.53%  TP=  93% SL=   7% TO=   0%
    ✅ 2025-05: n= 95  WR= 97.9%  tot= +6.33%
    ✅ 2025-06: n= 77  WR= 97.4%  tot= +4.88%
    ✅ 2025-07: n= 32  WR=100.0%  tot= +2.56%
    ✅ 2025-08: n= 26  WR= 96.2%  tot= +1.49%
    ✅ 2026-02: n= 13  WR=100.0%  tot= +1.04%
    Positive months: 5/5

────────────────────────────────────────────────────────────────────────────────
  BCHUSDT (NEW — out-of-sample)
────────────────────────────────────────────────────────────────────────────────
  Loading 767 liq files... 500 done (2,914)
  Loading ticker CSV... done (1,001,455)
  Building bars... 101,517 bars
  P95 signals: 128, with disp≥10: 60
  ✅ Config2 AGGR     n=  55  WR= 96.4%  avg=+0.0397%  tot=  +2.18%  sh=  +8.5  dd= 1.14%  TP=  96% SL=   0% TO=   4%
  ❌ Config1 SAFE     n=  55  WR= 83.6%  avg=-0.0021%  tot=  -0.11%  sh=  -0.4  dd= 1.66%  TP=  84% SL=  16% TO=   0%
    ✅ 2025-05: n= 16  WR=100.0%  tot= +1.28%
    ✅ 2025-06: n= 23  WR= 95.7%  tot= +0.62%
    ✅ 2025-07: n=  4  WR=100.0%  tot= +0.32%
    ❌ 2025-08: n=  8  WR= 87.5%  tot= -0.36%
    ✅ 2026-02: n=  4  WR=100.0%  tot= +0.32%
    Positive months: 4/5

────────────────────────────────────────────────────────────────────────────────
  LTCUSDT (NEW — out-of-sample)
────────────────────────────────────────────────────────────────────────────────
  Loading 951 liq files... 500 done (7,549)
  Loading ticker CSV... done (1,799,705)
  Building bars... 102,617 bars
  P95 signals: 270, with disp≥10: 126
  ✅ Config2 AGGR     n= 107  WR= 99.1%  avg=+0.0709%  tot=  +7.59%  sh= +34.0  dd= 0.89%  TP=  99% SL=   0% TO=   1%
  ✅ Config1 SAFE     n= 107  WR= 93.5%  avg=+0.0652%  tot=  +6.98%  sh= +17.3  dd= 1.39%  TP=  93% SL=   7% TO=   0%
    ✅ 2025-05: n= 47  WR=100.0%  tot= +3.76%
    ✅ 2025-06: n= 23  WR=100.0%  tot= +1.84%
    ✅ 2025-07: n= 12  WR=100.0%  tot= +0.96%
    ✅ 2025-08: n= 24  WR=100.0%  tot= +1.92%
    ❌ 2026-02: n=  1  WR=  0.0%  tot= -0.89%
    Positive months: 4/5

────────────────────────────────────────────────────────────────────────────────
  NEARUSDT (NEW — out-of-sample)
────────────────────────────────────────────────────────────────────────────────
  Loading 1014 liq files... 500 1000 done (7,569)
  Loading ticker CSV... done (1,131,997)
  Building bars... 101,960 bars
  P95 signals: 262, with disp≥10: 140
  ✅ Config2 AGGR     n= 122  WR= 97.5%  avg=+0.0622%  tot=  +7.59%  sh= +23.9  dd= 0.93%  TP=  98% SL=   0% TO=   2%
  ✅ Config1 SAFE     n= 122  WR= 91.0%  avg=+0.0482%  tot=  +5.89%  sh= +11.0  dd= 1.53%  TP=  91% SL=   9% TO=   0%
    ✅ 2025-05: n= 54  WR= 98.1%  tot= +3.31%
    ✅ 2025-06: n= 40  WR= 95.0%  tot= +2.03%
    ✅ 2025-07: n= 11  WR=100.0%  tot= +0.88%
    ✅ 2025-08: n= 10  WR=100.0%  tot= +0.80%
    ✅ 2026-02: n=  7  WR=100.0%  tot= +0.56%
    Positive months: 5/5

────────────────────────────────────────────────────────────────────────────────
  POLUSDT (NEW — out-of-sample)
────────────────────────────────────────────────────────────────────────────────
  Loading 678 liq files... 500 done (2,506)
  Loading ticker CSV... done (597,423)
  Building bars... 94,624 bars
  P95 signals: 106, with disp≥10: 65
  ✅ Config2 AGGR     n=  58  WR= 98.3%  avg=+0.0629%  tot=  +3.65%  sh= +21.9  dd= 0.91%  TP=  98% SL=   0% TO=   2%
  ✅ Config1 SAFE     n=  58  WR= 84.5%  avg=+0.0037%  tot=  +0.22%  sh=  +0.7  dd= 1.50%  TP=  84% SL=  16% TO=   0%
    ✅ 2025-05: n= 21  WR=100.0%  tot= +1.68%
    ✅ 2025-06: n= 25  WR= 96.0%  tot= +1.01%
    ✅ 2025-07: n=  3  WR=100.0%  tot= +0.24%
    ✅ 2025-08: n=  5  WR=100.0%  tot= +0.40%
    ✅ 2026-02: n=  4  WR=100.0%  tot= +0.32%
    Positive months: 5/5

────────────────────────────────────────────────────────────────────────────────
  TONUSDT (NEW — out-of-sample)
────────────────────────────────────────────────────────────────────────────────
  Loading 1011 liq files... 500 1000 done (9,899)
  Loading ticker CSV... done (2,490,643)
  Building bars... 102,932 bars
  P95 signals: 325, with disp≥10: 173
  ✅ Config2 AGGR     n= 146  WR= 98.6%  avg=+0.0323%  tot=  +4.72%  sh=  +2.6  dd= 6.62%  TP=  99% SL=   0% TO=   1%
  ✅ Config1 SAFE     n= 146  WR= 90.4%  avg=+0.0506%  tot=  +7.38%  sh= +12.2  dd= 1.15%  TP=  90% SL=   8% TO=   2%
    ❌ 2025-05: n= 70  WR= 98.6%  tot= -1.10%
    ✅ 2025-06: n= 36  WR= 97.2%  tot= +2.62%
    ✅ 2025-07: n=  7  WR=100.0%  tot= +0.56%
    ✅ 2025-08: n= 26  WR=100.0%  tot= +2.08%
    ✅ 2026-02: n=  7  WR=100.0%  tot= +0.56%
    Positive months: 4/5

────────────────────────────────────────────────────────────────────────────────
  XLMUSDT (NEW — out-of-sample)
────────────────────────────────────────────────────────────────────────────────
  Loading 606 liq files... 500 done (2,996)
  Loading ticker CSV... done (1,461,725)
  Building bars... 100,833 bars
  P95 signals: 120, with disp≥10: 67
  ✅ Config2 AGGR     n=  54  WR= 96.3%  avg=+0.0641%  tot=  +3.46%  sh= +35.4  dd= 0.35%  TP=  96% SL=   0% TO=   4%
  ✅ Config1 SAFE     n=  54  WR= 88.9%  avg=+0.0381%  tot=  +2.06%  sh=  +8.3  dd= 1.06%  TP=  89% SL=   9% TO=   2%
    ✅ 2025-05: n= 15  WR=100.0%  tot= +1.20%
    ✅ 2025-06: n= 15  WR=100.0%  tot= +1.20%
    ✅ 2025-07: n=  6  WR= 83.3%  tot= +0.05%
    ✅ 2025-08: n= 16  WR= 93.8%  tot= +0.85%
    ✅ 2026-02: n=  2  WR=100.0%  tot= +0.16%
    Positive months: 5/5

====================================================================================================
  CROSS-SYMBOL SUMMARY
====================================================================================================

      Symbol         Group  Liq Events   Signals   Fills      WR     Total   Sharpe      DD
  ──────────  ────────────  ──────────  ────────  ──────  ──────  ────────  ───────  ──────
  ✅ DOGEUSDT      ORIGINAL      93,913       692     539   97.0%   +21.76%    +5.6   5.44%
  ✅  SOLUSDT      ORIGINAL     189,603       892     670   95.1%   +27.44%    +8.8   5.75%
  ✅  ETHUSDT      ORIGINAL     328,388      1194     852   95.4%   +29.20%    +6.1   3.56%
  ✅  XRPUSDT      ORIGINAL     128,466       630     477   95.6%   +21.91%   +10.8   2.53%
  ✅  ADAUSDT           NEW      20,942       295     243   97.9%   +16.30%   +30.8   0.96%
  ✅  BCHUSDT           NEW       2,914        60      55   96.4%    +2.18%    +8.5   1.14%
  ✅  LTCUSDT           NEW       7,549       126     107   99.1%    +7.59%   +34.0   0.89%
  ✅ NEARUSDT           NEW       7,569       140     122   97.5%    +7.59%   +23.9   0.93%
  ✅  POLUSDT           NEW       2,506        65      58   98.3%    +3.65%   +21.9   0.91%
  ✅  TONUSDT           NEW       9,899       173     146   98.6%    +4.72%    +2.6   6.62%
  ✅  XLMUSDT           NEW       2,996        67      54   96.3%    +3.46%   +35.4   0.35%

  ────────────────────────────────────────────────────────────────────────────────
  ORIGINAL (in-sample):      n= 2538  tot=+100.31%  positive=4/4
  NEW (out-of-sample):       n=  785  tot= +45.48%  positive=7/7
  ALL COMBINED:              n= 3323  tot=+145.79%

  PER-TRADE QUALITY:
    Original avg: +0.0395%  WR: 95.7%
    New avg:      +0.0579%  WR: 98.0%
    Difference:   +0.0184%

  Done in 505s
